{
  "counterexample_id": "CE1",
  "related_claim_ids": ["CL2"],
  "related_construct_ids": ["low_power_counterexample_entry", "action_ceiling_clarity"],
  "related_mechanism_ids": ["M1"],
  "source_id": "S-misuse-1",
  "counterexample_type": "misuse",
  "impact_scope": "七闸分值被操作方试图用作人员处分依据。",
  "text_consequence": "在七闸模板中加粗声明分值不能单独授权处置。",
  "tool_consequence": "校验器阻断 disposition_basis 和总分化字段。",
  "action_ceiling_change": "行动上限从内部复核降为暂停使用并启动误用复核。",
  "version_writeback": "v5-dlc-alpha.1 记录误用红线并更新模板。",
  "withdrawal_condition": "如果工具界面仍诱导用户总分化或处分化，应撤回该工具版本。"
}
